project_name,project_number,facility_name,location_address,location_county,start_date,completion_date,est_cost,work_type,fund_type,scope,sq_ft,own_name,own_address,own_phone,design_name,design_address,design_phone,project_url,tenant_name
Sysgration TI Phase 2,TABS2026003179,Sysgration America Corporation,"3724 E Plano Pkwy, Plano, TX 75074",Collin,11/3/2025,4/30/2026,"$4,000,000",Renovation/Alteration,"This project is privately funded, on private land for private use.",Tenant finish out of a warehouse building for manufacturing.,"40,000 ft 2",Sysgration America Corpporation,"3724 E Plano Pkwy, Plano, Texas 75074",(626) 205-0488,Merriman Anderson Architects Inc.,"300 N. Field St, Dallas, Texas 75102",214.987-1299,https://www.tdlr.texas.gov/TABS/Search/Project/TABS2026003179,
North Fields Park Multi-Family Blk A Lot 4,TABS2026003137,"North Fields Investment Partners, LP","PGA Parkway, Frisco, TX 75033",Collin,2/2/2026,11/2/2026,"$4,500,000",New Construction,"This project is privately funded, on private land for private use.","19.08 AC park in a new Fields Multi-family development.  Includes park trails, signage and site furnishings, dog parks, sport courts, and ","831,125 ft 2","North Fields Investment Partners, LP","1900 N Akard St Dallas suite 1100, Dallas, Texas 75201",(214) 978-8761,,,,https://www.tdlr.texas.gov/TABS/Search/Project/TABS2026003137,
Paris Baguette,TABS2026003065,Village at 121,"5500 State Highway 121, Suite 100, Plano, TX 75024",Collin,1/1/2026,4/1/2026,"$700,000",Renovation/Alteration,"This project is privately funded, on private land for private use.","Commercial tenant improvement of existing space to new food service establishment concept - Paris Baguette.  New kitchen equipment, interior partition walls, plumbing, mechanical, and electrical scopes.  New 392 SF exterior patio and railing.","2,814 ft 2",121 Preston Retail,"8105 Rasor Boulevard, Suite 114, Plano, Texas 75024",(214) 619-9929,ONE Architecture,"8686 N. Central Avenue Suite 166, Phoenix, Arizona 85020",(602) 266-2712,https://www.tdlr.texas.gov/TABS/Search/Project/TABS2026003065,Punya Kushalappa and Charanjit Singh
Centerfield Baseball Academy,TABS2026003056,Centerfield Baseball Academy,"3420 K Ave, Unit 316, Plano, TX 75074",Collin,10/20/2025,11/28/2025,"$113,143",Renovation/Alteration,"This project is privately funded, on private land for private use.",690 SF INTERIOR LOBBY RENOVATION,690 ft 2,"RPI HMart Town Center, Ltd.","2929 Carlisle Street Ste 170, Dallas, Texas 75204",(972) 250-1486,Creative Accessible Design,"PO Box 491, Maypearl, Texas 76064",(254) 659-7288,https://www.tdlr.texas.gov/TABS/Search/Project/TABS2026003056,Linty Ingram
MCCATHERN EXPANSION,TABS2026003041,THE STAR,"1 COWBOYS WAY SUITE #175, Frisco, TX 75034",Collin,10/9/2025,4/9/2026,"$105,948",Renovation/Alteration,"This project is privately funded, on private land for private use.","THE SCOPE OF THIS PROJECT IS A NON-STRUCTURAL INTERIOR FINISH-OUT IN AN EXISTING SINGLE FLOOR SUITE. SCOPE INCLUDES HVAC, AND ELECTRICAL.","6,307 ft 2",BLUE STAR HQ,"1 COWBOYS WAY SUITE 100, FRISCO, Texas 75034",(214) 878-2842,idGroup,"2641 Irving Blvd., Dallas, Texas 75207",(214) 638-6800,https://www.tdlr.texas.gov/TABS/Search/Project/TABS2026003041,
Expansion Stonbridge Surgery Center,TABS2026003034,Stonebridge Surgery Center,"8855 SYNERGY DR, Mckinney, TX 75070",Collin,11/1/2025,11/1/2026,"$2,790,000",Additions to Existing Building,"This project is privately funded, on private land for private use.",SHELL EXPANSION OF EXISTING SURGERY CENTER IN MCKINNEY TEXAS. PROJECT TO INCLUDE SELECT  DEMOLITION OF EXISTING STRUCTURE.,"13,570 ft 2",WILSON CREEK PROPERTY HOLDINGS LLC,"8855 SYNERGY DR, MCKINNEY, Texas 75070",(214) 212-1538,GHC Architects,"5000 Quorum Drive Suite 500, Dallas, Texas 75254",(214) 378-9810,https://www.tdlr.texas.gov/TABS/Search/Project/TABS2026003034,
Alpara,TABS2026003023,Craig Ranch medical pavilion,"6045 Alma Road, Mckinney, TX 75070",Collin,12/1/2025,4/6/2026,"$750,000",Renovation/Alteration,"This project is privately funded, on private land for private use.",Renovation to existing suite,"6,500 ft 2",AG-AF Craig Ranch Owner LP,"5910 N. Central Expressway Aurora, Dallas, Texas 75206",(972) 897-4961,MG Designs LLC,"821 Aurora Street, Houston, Texas 77009",(713) 269-0311,https://www.tdlr.texas.gov/TABS/Search/Project/TABS2026003023,parker quinn
In Charge Electrical Services,TABS2026002993,Star Business Park Bldg 1B,"8101 Corporate Way Suite 200, Frisco, TX 75035",Collin,10/15/2025,2/28/2026,"$725,000",Renovation/Alteration,"This project is privately funded, on private land for private use.",Finish out of existing shell,"3,952 ft 2",STAR BUSINESS PARK LLC,"1 Cowboys Way, Frisco, Texas 75034",(214) 437-3653,Alliance Architects Inc.,"1600 N Collins Blvd 1000, Richardson, Texas 75080",(972) 233-0400,https://www.tdlr.texas.gov/TABS/Search/Project/TABS2026002993,
Tous Les Jours McKinney,TABS2026002960,N/A,"7645 S Custer Rd, Suite 444 & 452, Mckinney, TX 75070",Collin,12/15/2025,2/16/2026,"$1,000,000",Renovation/Alteration,"This project is privately funded, on private land for private use.","Combination and alteration of 2 existing adjacent strip centre spaces into a new Tous Les Jours Bakery with new kitchen equipment, interior walls, mechanical, electrical and plumbing work & finishes. We are combining two suites, 444 & 452 into one.","4,509 ft 2",Emily D. Hernandez,"4500 Bissonnet St Suite 200, Bellaire, Texas 77401",(713) 693-1437,AEP America,"PO Box 123655, Fort Worth, Texas 76121",(214) 702-1528,https://www.tdlr.texas.gov/TABS/Search/Project/TABS2026002960,Sundeep Bande
Firefly Retail Pump and Restroom Building,TABS2026002958,Firefly Retail Pump and Restroom Building,"Fireglass Way, Frisco, TX 75078",Collin,12/15/2025,5/15/2026,"$400,000",New Construction,"This project is privately funded, on private land for private use.",New pump and restroom building.,"1,241 ft 2",Firefly Land Holdings I LLC,"1321 Markum Gate Way, Fort Worth, Texas 76126",817-850-5334,WARD ARCHITECTURE PLLC,"5004 THOMPSON TERRACE, SUITE 107, COLLEYVILLE, Texas 76034",817-281-5600,https://www.tdlr.texas.gov/TABS/Search/Project/TABS2026002958,
HomeVestors,TABS2026002955,Signature Exchange North,"14785 Preston Road Suite 750, Dallas, TX 75254",Collin,10/15/2025,12/30/2025,"$500,000",Renovation/Alteration,"This project is privately funded, on private land for private use.",Tenant improvement,"10,557 ft 2",Signature Exchange Property Owner LLC,"277 Park Avenue, New York, New York 10172",(972) 991-5100,ENTOS Design,"5400 LBJ Parkway Suite 125, Dallas, Texas 75240",(972) 770-2222,https://www.tdlr.texas.gov/TABS/Search/Project/TABS2026002955,
"Two Mission Plaza Tenant Work  Suites 207, 210 & 215",TABS2026002842,Two Mission Plaza,"1202 Richardson Drive, Richardson, TX 75080",Collin,10/15/2025,10/22/2025,"$70,000",Renovation/Alteration,"This project is privately funded, on private land for private use.",Renovation of existing tenant spaces,"6,870 ft 2",Dallas North Office LLC,"19752 MacArthur Blvd. Suite 300, Irvine, California 92612",(972) 666-6041,Richard Popham Architects,"17620 Lily Court, Dallas, Texas 75252",(713) 452-9600,https://www.tdlr.texas.gov/TABS/Search/Project/TABS2026002842,
Lasco - Photronics - 65nm Remodel Cleanrooms,TABS2026002787,Photronics,"601 Millennium Drive, Allen, TX 75013",Collin,10/25/2025,1/26/2026,"$250,000",New Construction,"This project is privately funded, on private land for private use.",Interior Design 5436 usf,"5,436 ft 2",Photronics,"601 Millennium Drive, Allen, Texas 75013",(972) 889-6326,MPI Architects,"4949 Addison Circle, Addison, Texas 75001",972-788-0078,https://www.tdlr.texas.gov/TABS/Search/Project/TABS2026002787,
"PRONTO PILATES • PLANO, TX",TABS2026002730,PRONTO PILATES,"2108 DALLAS PKWY SUITE 216C, Plano, TX 75093",Collin,11/7/2025,12/9/2025,"$125,000",Renovation/Alteration,"This project is privately funded, on private land for private use.","TENANT FINISHOUT OF EXISTING SPACE TO FUNCTION AS A PILATES WORKOUT AREA WITH RECEPTION, STORAGE AND COMMUNICATIONS ROOMS. REUSE OF EXISTING RESTROOMS. WORK SHALL INCLUDE NEW INTERIOR PARITIONS, INTERIOR FINISHES, NEW INTERIOR EQUIPMENT, LIGHTING, HV","2,152 ft 2",POLO TOWNE CROSSING PLANO TX LLC,"10250 CONSTALION BLVD. SUITE 2850, Los Angeles, California 90067",214-227-2443,Rogue Architects,"513 Main St Ste 300, Fort Worth, Texas 76102",817.529.6882,https://www.tdlr.texas.gov/TABS/Search/Project/TABS2026002730,
Magnolia/380,TABS2026002705,Magnolia/US380 Holdings LLC,"Southwest corner of US380 and Magnolia blvd, Little Elm, TX 75068",Collin,1/5/2026,7/15/2026,"$2,600,000",New Construction,"This project is privately funded, on private land for private use.","Design for two retail shell buildings of approximately 9,000 & 10,000 SF with a similar design. Building will be designed to be cold/dark for future tenants to finish out, to be steel and light framing by others","20,686 ft 2",Magnolia US380 Holdings LLC,"6315 Postell Ln, Frisco, Texas 75035",(646) 256-5704,CONDUIT A + D,"711 N Tennessee St, McKinney, Texas 75069",(972) 302-9747,https://www.tdlr.texas.gov/TABS/Search/Project/TABS2026002705,
Prose Ownsby Farms,TABS2026002702,Prose Ownsby Farms,"SEQ Preston Road and Ownsby Pkwy, Celina, TX 75009",Collin,12/25/2025,12/25/2026,"$1,451,946",New Construction,"This project is privately funded, on private land for private use.",New leasing clubhouse for multifamily apartment complex,"5,131 ft 2","Prose Ownsby Farms Venture, LLC","4925 Greenville Avenue, Suite 1270, Dallas, Texas 75206",(214) 389-2016,"HLR, Inc.","6201 W. Plano Pkwy Suite 100, Plano, Texas 75093",972-726-9400,https://www.tdlr.texas.gov/TABS/Search/Project/TABS2026002702,
Solena,TABS2026002686,Solena Clubhouse,"1605 Fox Drive, Princeton, TX 75407",Collin,1/2/2025,10/17/2025,"$1,749,662",New Construction,"This project is privately funded, on private land for private use.","A new clubhouse facility with 2243 SF, built for a residential development that's under a separate permit.","2,243 ft 2",CRE-MPC Princeton Owner LLC,"5000 W. 95th Street, Suite 250, Prairie Village, Kansas 66207",(469) 504-6245,Investwell Architects LLC,"24285 Katy Freeway Suite 400-D, Katy, Texas 77494",346-387-7177,https://www.tdlr.texas.gov/TABS/Search/Project/TABS2026002686,
HeartPlace Frisco Medical Clinic,TABS2026002684,Frisco Medical Pavilion II,"12850 Dallas Pkwy, Suite 250, Frisco, TX 75033",Collin,9/18/2025,2/1/2026,"$590,000",New Construction,"This project is privately funded, on private land for private use.",Interior office build out of a 1st generation space in a medical office building.,"3,885 ft 2",DRI/Frisco MOB LLC,"5949 Sherry Lane, Suite 760, Dallas, Texas 75225",(214) 831-4222,,,,https://www.tdlr.texas.gov/TABS/Search/Project/TABS2026002684,
Ono Hawaiian BBO - Wylie,TABS2026002649,Ono Hawaiian BBO,"2020 North State Hwy 78, Wylie, TX 75098",Collin,1/1/2026,5/31/2026,"$250,000",Renovation/Alteration,"This project is privately funded, on private land for private use.","Interior tenant improvement of an existing 2,501 sqft. restaurant space. No change in use, no addition ","2,501 ft 2",McGrane Living Trust,"5061 Rivedro St, Las Vegas, Nevada 89135",(775) 267-7438,Prosper Architects,"134 S Glassell Street Suite K, Orange, California 92866",(949) 373-4401,https://www.tdlr.texas.gov/TABS/Search/Project/TABS2026002649,Ono Hawaiian BBQ
McKinney Christian Academy Phase 1B and Storm Shelter,TABS2026002643,McKinney Christian Academy,"3601 Bois D'Arc Road, Mckinney, TX 75071",Collin,1/5/2026,3/30/2027,"$6,472,850",New Construction,"This project is privately funded, on private land for private use.","2-story science bldg. (11,300 SF) and 1-story storm shelter bldg. (4,500 SF) with Science / CTE labs & classrooms. ","15,800 ft 2",McKinney Christian Academy,"3601 Bois D'Arc Road, McKinney, Texas 75071",214-544-2658,Perkins&Will,"2218 Bryan Street, Suite 200, Dallas, Texas 75201",214-283-8700,https://www.tdlr.texas.gov/TABS/Search/Project/TABS2026002643,
Interior Build-Out Plan,TABS2026002630,Giant Leap Adventure Park,"910 W. Parker Rd, #250, Plano, TX 75075",Collin,10/20/2025,11/15/2025,"$150,000",Renovation/Alteration,"This project is privately funded, on private land for private use.","Tenant build-out to include construction of small commercial kitchen, 7 party rooms, and men's, women's, and family restrooms and interior demolition.","29,460 ft 2","David Hoppenstein Family, LTD","1131 Rockingham Dr., Suite 128, Richardson, Texas 75080",(972) 931-4000,Gregory Hagmann,"404 Provincetown Ln, Richardson, Texas 75080",214-926-7575,https://www.tdlr.texas.gov/TABS/Search/Project/TABS2026002630,
ASML Plano CS Office,TABS2026002614,ASML Plano CS Office,"2301 W. Plano Parkway, Suite 201, Plano, TX 75075",Collin,10/13/2025,1/31/2029,"$1,700,000",Renovation/Alteration,"This project is privately funded, on private land for private use.","Interior fit-out of approximately 5,000 SF on the second floor of the existing building for office use. Work includes new partitions, ceilings, interior finishes, doors, hardware, and accessories, as well as associated modifications to MEP, fire prot","5,000 ft 2","Dalplano, Inc.","2301 W. Plano Parkway, Suite 108, Plano, Texas 75075",(972) 774-2501,"HDR Engineering, Inc.","8750 N. Central Expressway, Suite 100, Dallas, Texas 75231",214-755-9552,https://www.tdlr.texas.gov/TABS/Search/Project/TABS2026002614,Ricardo Martinez
Brandon Industries _ Facility Expansion,TABS2026002582,Brandon Industries,"1601 Wilmeth Road, Mckinney, TX 75069",Collin,12/1/2025,11/20/2026,"$1,500,000",New Construction,"This project is privately funded, on private land for private use.","Construction of a 30,000-sf tilt-wall concrete building. ","30,000 ft 2",Hall Properties,"1601 Wilmeth Road, McKinney, Texas 75069",(972) 542-3000,Perez Architecture Studio,"PO Box 223, Crandall, Texas 75114",(214) 718-0584,https://www.tdlr.texas.gov/TABS/Search/Project/TABS2026002582,
