project_name,project_number,facility_name,location_address,location_county,start_date,completion_date,est_cost,work_type,fund_type,scope,sq_ft,own_name,own_address,own_phone,design_name,design_address,design_phone,project_url,tenant_name
Hughes House,TABS2025012518,"Hughes House Phase III  (Legal Description: Lot 2, Block B Cavile Addition & Block B J.A. Cavile Pl","East Rosedale Street & Etta Street, Fort Worth, TX 76105",Tarrant,6/30/2025,9/30/2026,"$12,800,000",New Construction,"This project involves public funds, public land, or is a Federally funded roadway project.","Approximately 2 acres 91,300 gross SF, 78 Unit Multi Family project with playground and multi-purpose room.","91,300 ft 2","FW Hughes House III GP, LLC","100 N. Broadway Suite 100, St. Louis, Missouri 63102",(314) 335-2884,Bennett Partners,"640 Taylor Street Suite 2323, Fort Worth, Texas 76102",(817) 335-4991,https://www.tdlr.texas.gov/TABS/Search/Project/TABS2025012518,
Town North Shopping Center,TABS2025012500,Town North Shopping Center,"975 N Cooper St Ste 979, Arlington, TX 76011",Tarrant,7/1/2025,11/1/2025,"$990,000",Renovation/Alteration,"This project is privately funded, on private land for private use.",LANDLORD WORK TO RAISE THE STRUCTURE & INTERIOR CEILING CLEARANCE. NO CHANGE OF USE. NO INCREASE IN SQUARE FOOTAGE. NO ELECTRICAL WORK. NO PLUMBING WORK. NO MECHANICAL WORK. NO FIRE SPRINKLER WORK. NO FIRE ALARM WORK.,"10,313 ft 2",Town North Arlington Partners LLC,"4809 Cole Ave Ste 330, Dallas, Texas 75205",(214) 393-1833,AEP America LLC,"PO Box 123655, Fort Worth, Texas 76121",(214) 702-1528,https://www.tdlr.texas.gov/TABS/Search/Project/TABS2025012500,
Ott Cribbs Safety Center Renovations - Package 3,TABS2025012438,Ott Cribbs Safety Center,"620 W Division St, Arlington, TX 76011",Tarrant,4/1/2025,12/31/2025,"$4,250,000",Renovation/Alteration,"This project involves public funds, public land, or is a Federally funded roadway project.","Plumbing repairs, elevator modernization, storefront replacement and exterior finish repairs.","109,876 ft 2",City of Arlington,"101 W. Abram Street, Arlington, Texas 76010",(817) 459-6777,"Elements of Architecture, Inc.","1201 6th Ave Suite 100, Fort Worth, Texas 76104",(817) 333-2880,https://www.tdlr.texas.gov/TABS/Search/Project/TABS2025012438,
Spec Suite 230,TABS2025012421,Southlake Town Square,"Southlake Town Square 181 Grand Avenue Floor 2 Suite 230, Southlake, TX 76092",Tarrant,3/15/2025,7/1/2025,"$492,000",Renovation/Alteration,"This project is privately funded, on private land for private use.","Spec Suite tenant Finish out. 2,854 RSF","2,854 ft 2","KRG Town Square Ventures, LLC","285 Grand Ave Suite 210, Southlake, Texas 76092",972-442-6770,Jones Commercial Interiors,"3900 Willow St Suite 150, Dallas, Texas 75226",972-690-3400,https://www.tdlr.texas.gov/TABS/Search/Project/TABS2025012421,
Spec Suite 223,TABS2025012418,Southlake Town Square,"Southlake Town Square 1400 Civic Place Floor 2 Suite 2223, Southlake, TX 76092",Tarrant,3/15/2025,7/1/2025,"$308,000",Renovation/Alteration,"This project is privately funded, on private land for private use.",Spec Suite tenant Finish out. 998 RSF,998 ft 2,"KRG Town Square Ventures, LLC","285 Grand Ave Suite 210, Southlake, Texas 76092",972-442-6770,Jones Commercial Interiors,"3900 Willow St Suite 150, Dallas, Texas 75226",972-690-3400,https://www.tdlr.texas.gov/TABS/Search/Project/TABS2025012418,
Chase Azle,TABS2025012413,Chase Azle,"700 Boyd Road, Azle, TX 76020",Tarrant,7/21/2025,3/3/2026,"$3,100,000",New Construction,"This project is privately funded, on private land for private use.","New Construction of a 1-Story Retail Banking Center w/ Drive-Up ATM - (3,319 sq ft)","3,319 ft 2","TC Azle Investments, LLC.","3131 McKinney Avenue, Suite 500, Dallas, Texas 75204",(214) 740-4020,Rouch Architects,"1445 Ross Avenue, Suite 5700, Dallas, Texas 75252",(214) 997-6029,https://www.tdlr.texas.gov/TABS/Search/Project/TABS2025012413,
Spec Suite 201,TABS2025012396,Southlake Town Square,"Southlake Town Square 1460 Main Street Floor 2 Suite 201, Southlake, TX 76092",Tarrant,3/15/2025,7/1/2025,"$480,000",Renovation/Alteration,"This project is privately funded, on private land for private use.","Spec Suite tenant Finish out. 1,998 RSF","1,988 ft 2","KRG Town Square Ventures, LLC","285 Grand Ave Suite 210, Southlake, Texas 76092",972-442-6770,Jones Commercial Interiors,"3900 Willow St Suite 150, Dallas, Texas 75226",972-690-3400,https://www.tdlr.texas.gov/TABS/Search/Project/TABS2025012396,
Heart Place Arlington Imaging Clinic,TABS2025012388,Texas Clinic at Arlington,"400 W Arbrook Blvd, Suite 120, Arlington, TX 76014",Tarrant,2/11/2025,2/11/2026,"$350,000",Renovation/Alteration,"This project is privately funded, on private land for private use.","Renovation and added a PET machine with controls and hot lab, and a toilet. Scope includes revised walls, flooring, ceiling, countertop, mechanical and electrical.","3,056 ft 2","ARHC TCARLTX01, LLC","500 North Hurstbourne Pkwy, Suite 200, Louisville, Kentucky 40222",(312) 268-4170,Corgan,"401 North Houston Street, Dallas, Texas 75202",(214) 977-3540,https://www.tdlr.texas.gov/TABS/Search/Project/TABS2025012388,Rodney Jennings
McDonald's 42-2983 (OOFR) Arlington,TABS2025012377,McDonald's,"800 W. Pioneer Parkway, Arlington, TX 76013",Tarrant,7/7/2025,8/7/2025,"$135,000",Renovation/Alteration,"This project is privately funded, on private land for private use.",New customer service area and new dining seating and finishes per Decor,"1,477 ft 2","McDonald's USA, LLC","110 N. Carpenter St., Chicago, Illinois 60607",(214) 789-2646,Castles Design Group,"3801 Kirby Drive, Ste 600, Houston, Texas 77098",(713) 664-7974,https://www.tdlr.texas.gov/TABS/Search/Project/TABS2025012377,
SECURITY SUITE,TABS2025012361,777 MAIN STREET,"777 MAIN STREET SUITE C85, Fort Worth, TX 76102",Tarrant,2/26/2025,5/21/2025,"$325,000",Renovation/Alteration,"This project is privately funded, on private land for private use.","renovation to existing security suite, storage and IT room.",923 ft 2,"F7 SSSM, LLC","3455 Peachtree Rd, ATLANTA, Georgia 30326",(817) 321-1100,JACOBS ENGINEERING,"777 MAIN STREET, FORT WORTH, Texas 76102",(719) 684-6980,https://www.tdlr.texas.gov/TABS/Search/Project/TABS2025012361,
Texas Health Breeze Urgent Care (392542201),TABS2025012343,173 E Bonds Ranch Road,"173 E Bonds Ranch Road, Fort Worth, TX 76131",Tarrant,6/16/2025,9/15/2025,"$544,000",Renovation/Alteration,"This project is privately funded, on private land for private use.",3200 SF of tenant improvement,"3,200 ft 2","NEC 287/Bonds Ranch, Ltd.","3102 Maple Ave, Suite 500, Dallas, Texas 75201",214-720-6600,DLR Group,"2500 Pacific Ave., Suite 1600, Dallas, Texas 75226",(214) 747-2511,https://www.tdlr.texas.gov/TABS/Search/Project/TABS2025012343,Kyle Bradfield
Dan Dipert CTC Addition,TABS2025012340,Dan Dipert CTC,"2101 Browning Drive, Arlington, TX 76010, Arlington, TX 76010",Tarrant,7/1/2025,9/1/2026,"$12,000,000",Additions to Existing Building,"This project involves public funds, public land, or is a Federally funded roadway project.",New Storm Shelter and Classroom Addition,"28,393 ft 2",Arlington ISD,"1201 Colorado Lane, Arlington, Texas 76015",(682) 867-4611,"VLK Architects, Inc.","5801 Tennyson Pkwy #100, Plano, Texas 75024",(972) 265-1885,https://www.tdlr.texas.gov/TABS/Search/Project/TABS2025012340,
Compass Church - Colleyville,TABS2025012328,Compass Church - Colleyville,"2600 HALL JOHNSON ROAD, Colleyville, TX 76034",Tarrant,3/26/2025,5/21/2025,"$150,000",Renovation/Alteration,"This project is privately funded, on private land for private use.",SECOND FLOOR RENOVATION OF AN EXISTING STORAGE SPACE INTO A SPECIAL NEEDS CLASSROOM,"2,000 ft 2",HIGHLAND MEADOWS CHRISTIAN,"2600 HALL JOHNSON ROAD, COLLEYVILLE, Texas 76034",817-259-2311,WARD ARCHITECTURE PLLC,"5004 THOMPSON TERRACE SUITE 107, COLLEYVILLE, Texas 76034",817-281-5600,https://www.tdlr.texas.gov/TABS/Search/Project/TABS2025012328,
DFW Airport Terminal D - Coffee Bean & Tea Leaf + Bakery,TABS2025012324,DFW Airport,"2333 South International Parkway, Dfw Airport, TX 75261",Tarrant,4/15/2025,8/30/2025,"$1,000,000",Renovation/Alteration,"This project is privately funded, on private land for private use.",Existing shell space finish-out for new concessions venue at airport terminal.  The total square footage is 1357,"1,357 ft 2",DFW Airport,"2400 Aviation Drive, DFW Airport, Texas 75261",(972) 973-5696,Rouch Architects,"1445 Ross Avenue, Suite 5700, Dallas, Texas 75202",(214) 997-6029,https://www.tdlr.texas.gov/TABS/Search/Project/TABS2025012324,Gilbert Aranza
Playground Replacement Multi-Campus,TABS2025012323,David L. Walker Elementary School,"9901 Hemphill St, Fort Worth, TX 76134",Tarrant,2/28/2025,7/31/2025,"$550,000",Renovation/Alteration,"This project involves public funds, public land, or is a Federally funded roadway project.",Playground replacements,"4,896 ft 2",Crowley ISD,"1900 Crowley Pride Dr, Fort Worth, Texas 76134",817-297-5800,VLK Architects,"1320 Hemphill St Suite 400, Fort Worth, Texas 76104",(817) 633-1600,https://www.tdlr.texas.gov/TABS/Search/Project/TABS2025012323,
Playground Replacement Multi-Campus,TABS2025012322,Dallas Park Elementary School,"8700 Viridian Ln, Fort Worth, TX 76123",Tarrant,2/28/2025,7/31/2025,"$550,000",Renovation/Alteration,"This project involves public funds, public land, or is a Federally funded roadway project.",Playground replacements,"4,896 ft 2",Crowley ISD,"1900 Crowley Pride Dr, Fort Worth, Texas 76134",817-297-5800,VLK Architects,"1320 Hemphill St Suite 400, Fort Worth, Texas 76104",(817) 633-1600,https://www.tdlr.texas.gov/TABS/Search/Project/TABS2025012322,
Playground Replacement Multi-Campus,TABS2025012320,S.H. Crowley Elementary School,"10525 McCart Ave, Crowley, TX 76036",Tarrant,2/28/2025,7/31/2025,"$550,000",Renovation/Alteration,"This project involves public funds, public land, or is a Federally funded roadway project.",Playground replacements,"4,896 ft 2",Crowley ISD,"1900 Crowley Pride Dr, Fort Worth, Texas 76134",817-297-5800,VLK Architects,"1320 Hemphill St Suite 400, Fort Worth, Texas 76104",(817) 633-1600,https://www.tdlr.texas.gov/TABS/Search/Project/TABS2025012320,
Playground Replacement Multi-Campus,TABS2025012319,Jackie Carden Elementary School,"3701 Garden Springs Dr, Fort Worth, TX 76123",Tarrant,2/28/2025,7/31/2025,"$550,000",Renovation/Alteration,"This project involves public funds, public land, or is a Federally funded roadway project.",Playground replacements,"4,896 ft 2",Crowley ISD,"1900 Crowley Pride Dr, Fort Worth, Texas 76134",817-297-5800,VLK Architects,"1320 Hemphill St Suite 400, Fort Worth, Texas 76104",(817) 633-1600,https://www.tdlr.texas.gov/TABS/Search/Project/TABS2025012319,
Playground Replacement Multi-Campus,TABS2025012318,Oakmont Elementary School,"6651 Oakmont Trail, Fort Worth, TX 76132",Tarrant,2/28/2025,7/31/2025,"$550,000",Renovation/Alteration,"This project involves public funds, public land, or is a Federally funded roadway project.",Playground replacements,"4,896 ft 2",Crowley ISD,"1900 Crowley Pride Dr, Fort Worth, Texas 76134",817-297-5800,VLK Architects,"1320 Hemphill St Suite 400, Fort Worth, Texas 76104",(817) 633-1600,https://www.tdlr.texas.gov/TABS/Search/Project/TABS2025012318,
Playground Replacement Multi-Campus,TABS2025012315,Bess Race Elementary School,"537 S Heights Dr, Crowley, TX 76036",Tarrant,2/28/2025,7/31/2025,"$550,000",Renovation/Alteration,"This project involves public funds, public land, or is a Federally funded roadway project.",Playground replacements,"4,896 ft 2",Crowley ISD,"1900 Crowley Pride Dr, Fort Worth, Texas 76134",817-297-5800,VLK Architects,"1320 Hemphill St Suite 400, Fort Worth, Texas 76104",(817) 633-1600,https://www.tdlr.texas.gov/TABS/Search/Project/TABS2025012315,
Playground Replacement Multi-Campus,TABS2025012313,Mary Harris Elementary School,"8400 W Cleburne Rd, Fort Worth, TX 76123",Tarrant,2/28/2025,7/31/2025,"$550,000",Renovation/Alteration,"This project involves public funds, public land, or is a Federally funded roadway project.",Playground replacements,"4,896 ft 2",Crowley ISD,"1900 Crowley Pride Dr, Fort Worth, Texas 76134",817-297-5800,VLK Architects,"1320 Hemphill St Suite 400, Fort Worth, Texas 76104",(817) 633-1600,https://www.tdlr.texas.gov/TABS/Search/Project/TABS2025012313,
Playground Replacement Multi-Campus,TABS2025012312,J.A. Hargrave Elementary School,"9200 Poynter St, Fort Worth, TX 76123",Tarrant,2/28/2025,7/31/2025,"$550,000",Renovation/Alteration,"This project involves public funds, public land, or is a Federally funded roadway project.",Playground replacements,"4,896 ft 2",Crowley ISD,"1900 Crowley Pride Dr, Fort Worth, Texas 76134",817-297-5800,VLK Architects,"1320 Hemphill St Suite 400, Fort Worth, Texas 76104",(817) 633-1600,https://www.tdlr.texas.gov/TABS/Search/Project/TABS2025012312,
Playground Replacement Multi-Campus,TABS2025012311,Parkway Elementary School,"1320 W Everman Pkwy, Fort Worth, TX 76134",Tarrant,2/28/2025,7/31/2025,"$550,000",Renovation/Alteration,"This project involves public funds, public land, or is a Federally funded roadway project.",Playground replacements,"4,896 ft 2",Crowley ISD,"1900 Crowley Pride Dr, Fort Worth, Texas 76134",817-297-5800,VLK Architects,"1320 Hemphill St Suite 400, Fort Worth, Texas 76104",(817) 633-1600,https://www.tdlr.texas.gov/TABS/Search/Project/TABS2025012311,
Playground Replacement Multi-Campus,TABS2025012309,Sidney H. Poynter Elementary School,"8036 Cedar Lake Ln, Fort Worth, TX 76123",Tarrant,2/28/2025,7/31/2025,"$550,000",Renovation/Alteration,"This project involves public funds, public land, or is a Federally funded roadway project.",Playground replacements,"4,896 ft 2",Crowley ISD,"1900 Crowley Pride Dr, Fort Worth, Texas 76134",817-297-5800,VLK Architects,"1320 Hemphill St Suite 400, Fort Worth, Texas 76104",(817) 633-1600,https://www.tdlr.texas.gov/TABS/Search/Project/TABS2025012309,
Playground Replacement Multi-Campus,TABS2025012307,Sue Crouch Elementary School,"8036 Cedar Lake Ln, Fort Worth, TX 76123, Fort Worth, TX 76123",Tarrant,2/28/2025,7/31/2025,"$550,000",Renovation/Alteration,"This project involves public funds, public land, or is a Federally funded roadway project.",Playground replacements,"4,896 ft 2",Crowley ISD,"1900 Crowley Pride Dr, Fort Worth, Texas 76134",817-297-5800,VLK Architects,"1320 Hemphill St Suite 400, Fort Worth, Texas 76104",(817) 633-1600,https://www.tdlr.texas.gov/TABS/Search/Project/TABS2025012307,
Playground Replacement Multi-Campus,TABS2025012305,June W. Davis Elementary School,"6301 Rockrose Trail, Fort Worth, TX 76123",Tarrant,2/28/2025,7/31/2025,"$550,000",Renovation/Alteration,"This project involves public funds, public land, or is a Federally funded roadway project.",Playground replacements,"4,896 ft 2",Crowley ISD,"1900 Crowley Pride Dr, Fort Worth, Texas 76134",817-297-5800,VLK Architects,"1320 Hemphill St Suite 400, Fort Worth, Texas 76104",(817) 633-1600,https://www.tdlr.texas.gov/TABS/Search/Project/TABS2025012305,
"MCD BEACH & 820 - HALTOM CITY, TX",TABS2025012286,"MCD BEACH & 820 - HALTOM CITY, TX","NEC OF N BEACH ST & TANACROSS DR, Haltom City, TX 76137",Tarrant,6/1/2025,12/31/2025,"$1,500,000",New Construction,"This project is privately funded, on private land for private use.",New Construction McDonalds,"3,829 ft 2",MCDONALD'S USA LLC,"110 N. CARPENTER STREET, CHICAGO, Illinois 60607",(469) 865-7916,"JAW ARCHITECTS, INC.","6115 CAMP BOWIE BLVD STE 200, FORT WORTH, Texas 76116",(817) 705-3387,https://www.tdlr.texas.gov/TABS/Search/Project/TABS2025012286,
Glenview Shell Building,TABS2025012261,Glenview Shell Building,"5320 Glenview Dr, Haltom City, TX 76117",Tarrant,4/1/2025,12/31/2025,"$3,980,088",New Construction,"This project is privately funded, on private land for private use.",New shell building office / warehouse,"46,768 ft 2","Kisabeth Furniture, LLC c/o Keith Webster","5320 Glenview Dr, Haltom City, Texas 76117",(214) 773-4441,"RGA Architects, Inc","301 S Oak St Suite 100, Roanoke, Texas 76262",972-955-3218,https://www.tdlr.texas.gov/TABS/Search/Project/TABS2025012261,
Wellington Amenity Center,TABS2025012259,Wellington Amenity Center,"11401 Wulstone Road, Fort Worth, TX 76052",Tarrant,3/1/2025,10/1/2025,"$3,190,565",New Construction,"This project is privately funded, on private land for private use.","Open-air main pavilion with bathroom facility's,  swimming pool/deck/shade structures, playground and shade structure, built-in gas grill, gas fire pit.  Parking lot. Trial and landscape improvements.","1,000 ft 2",Hanover Property Company,"3001 Knox Street, Suite 405, Dallas, Texas 75205, Dallas, Texas 75205",214-445-2211,LJA Engineering,"2150 S. Central Expressway, Suite 300, Mckinney,, Mckinney, Texas 75070",214-620-2741,https://www.tdlr.texas.gov/TABS/Search/Project/TABS2025012259,
Project Durden Phase 2,TABS2025012236,Silver Creek Building 2,"9449 Silver Creek Rd., Fort Worth, TX 76108",Tarrant,3/1/2025,7/1/2025,"$2,870,000",Additions to Existing Building,"This project is privately funded, on private land for private use.",Renovation to an existing shell,"548,659 ft 2","FW 820, LLC, a Texas limited liability company","13191 Crossroads Pkwy. N 6th Floor, Industry, California 91746",(817) 710-7367,,,,https://www.tdlr.texas.gov/TABS/Search/Project/TABS2025012236,
Ryan Law,TABS2025012234,Burnett Plaza,"801 cherry street, suite 1450, Fort Worth, TX 76102",Tarrant,2/19/2025,4/16/2025,"$79,000",Renovation/Alteration,"This project is privately funded, on private land for private use.",interior finish out of existing office space ,"3,357 ft 2","Burnett Cherry Street, LLC","1140 Avenue of the Americas, PH, new york, New York 10036",(917) 363-8739,Interprise Design,"14241 Dallas Parkway, suite 260, dallas, Texas 75254",(972) 385-3991,https://www.tdlr.texas.gov/TABS/Search/Project/TABS2025012234,
CNS Tumbling Trail,TABS2025012222,CNS Tumbling Trail,"6901 Tumbling Trail, Fort Worth, TX 76116",Tarrant,3/3/2025,7/1/2025,"$400,000",Renovation/Alteration,"This project is privately funded, on private land for private use.","Remodel 2,944 SF house","2,944 ft 2","CFNS Texas, LLC","5212 Ashe Road,, Bakersfield, California 93313",661-809-3408,Covenant Architecture,"106 E Church Street,, Weatheford, Texas 76086",817-565-9826,https://www.tdlr.texas.gov/TABS/Search/Project/TABS2025012222,
Crescent Hotel Forth Worth - Courtyard Enclosure / Addition,TABS2025012216,Crescent Hotel Forth Worth,"3300 Camp Bowie Blvd Fort Worth, TX 76107, Fort Worth, TX 76107",Tarrant,6/2/2025,9/5/2025,"$2,200,000",Additions to Existing Building,"This project is privately funded, on private land for private use.",New addition partially covering an existing courtyard.  Kalwall roof and one new wall of exterior storefront glazing utilizing three existing exterior walls of the hotel to enclose the space.  This space will be fully conditioned and wet sprinklered.,"3,000 ft 2",GPIF CD Hotel LLC,"3230 Camp Bowie Blvd. Suite 500, Fort Worth, Texas 7617",214.880.4523,OZ Architecture,"3003 LarimerSt., Denver, Colorado 80205",(303) 861-5704,https://www.tdlr.texas.gov/TABS/Search/Project/TABS2025012216,
Drybar,TABS2025012205,ALLIANCE TOWN CENTER,"9409 SAGE MEADOW TRAIL STE 177, Fort Worth, TX 76177",Tarrant,4/15/2025,8/1/2025,"$225,000",Renovation/Alteration,"This project is privately funded, on private land for private use.",Tenant Finish for Salon,"1,911 ft 2",ATC INVESTORS LP,"2001 ROSS AVE STE 3400 Suite 1220, Dallas, Texas 75201",972-715-5846,Design Parameters LLC,"6373 Silver Stream Ln, Frisco, Texas 75036",(214) 784-5014,https://www.tdlr.texas.gov/TABS/Search/Project/TABS2025012205,Kim Pruitt
DFW Airport Terminal D - Chili's,TABS2025012190,DFW Airport,"2333 South International Parkway DFW Airport 75261, Dfw Airport, TX 75261",Tarrant,4/15/2025,8/30/2025,"$1,500,000",Renovation/Alteration,"This project is privately funded, on private land for private use.",Existing shell space finish-out for new concessions venue at airport terminal.  The total square footage is 5434,"5,434 ft 2",DFW Airport,"2400 Aviation Drive, DFW Airport, Texas 75261",(972) 973-5696,Rouch Architects,"1445 Ross Avenue Suite 5700, Dallas, Texas 75202",(214) 997-6029,https://www.tdlr.texas.gov/TABS/Search/Project/TABS2025012190,Gilbert Aranza
Crispy Cones NRH,TABS2025012181,Crispy Cones,"8633 Davis Blvd. #200, North Richland Hills, TX 76182",Tarrant,3/1/2025,5/30/2025,"$200,000",Renovation/Alteration,"This project is privately funded, on private land for private use.",Finish out shell space,"1,310 ft 2","Bomac IREG, LLC","PO Box 96011, Southlake, Texas 76092",(214) 986-6351,JRW and Associates,"1152 Bond Ave. #A, Rexburg, Idaho 83440",208-359-2309,https://www.tdlr.texas.gov/TABS/Search/Project/TABS2025012181,Aman Tamana
MMMC Nuc Med SPECT Renovation,TABS2025012161,Methodist Mansfield Medical Center,"2700 E Broad St, Mansfield, TX 76063",Tarrant,4/14/2025,9/1/2025,"$800,000",Renovation/Alteration,"This project is privately funded, on private land for private use.",renovation of roughly 1200 SF of nuclear medicine and spect rooms in  existing imaging department. Scope to include replacement of Nuclear Medicine equipment and SPECT equipment accompanied by a finish refresh of both rooms.  ,"1,200 ft 2",Methodist Health System,"403 W. Campbell Rd Suite 205, Richardson, Texas 75080",(214) 947-5263,Perkins&Will,"2218 Bryan Street Suite 200, Dallas, Texas 75201",(214) 325-2674,https://www.tdlr.texas.gov/TABS/Search/Project/TABS2025012161,
Cook Children's Kids' Place,TABS2025012151,Kid's Place,"TBD Fort Worth, Fort Worth, TX 76104",Tarrant,4/1/2025,2/1/2026,"$14,600,000",New Construction,"This project is privately funded, on private land for private use.","Kids' Place is a 25,000SF childcare center for Infants through Pre-kindergarten that is currently located on Cook Children's Medical Center (CCMC) Campus.","25,000 ft 2",Cook Children's Medical Center,"801 7th Ave., Fort Worth, Texas 76104",(682) 885-4021,HKS Inc.,"1227 Magnolia Ave Suite 200, Fort Worth, Texas 76104",(817) 231-7166,https://www.tdlr.texas.gov/TABS/Search/Project/TABS2025012151,
US Conec,TABS2025012145,Alliance Gateway 31,"5201 Alliance Gateway Freeway, Fort Worth, TX 76177",Tarrant,3/1/2025,7/1/2025,"$250,000",Renovation/Alteration,"This project is privately funded, on private land for private use.",Interior remodel of existing tenant finish out.,"46,047 ft 2",Hillwood Properties,"9800 Hillwood Pkwy, Suite 300, Fort Worth, Texas 76177",(817) 224-6073,BHA Studio,"3141 Hood Street, Suite 420, Dallas, Texas 75219",(214) 697-0761,https://www.tdlr.texas.gov/TABS/Search/Project/TABS2025012145,Brian Gimbel
Old Benbrook Rd Warehouse,TABS2025012129,Old Benbrook Rd Warehouse,"4924 Old Benbrook Rd, Fort Worth, TX 76116",Tarrant,11/1/2024,3/15/2025,"$200,000",Renovation/Alteration,"This project is privately funded, on private land for private use.",Renovate interior and bathrooms to make ADA compliant,"9,400 ft 2",52095 Limited Partners,"4303 Lakeshore Drive, Granbury, Texas 76048",(817) 521-5989,,,,https://www.tdlr.texas.gov/TABS/Search/Project/TABS2025012129,
The big philly,TABS2025012118,The Big Philly,"Suite 104, 915 E. Rd Six Flags street, Arlington, TX 76011",Tarrant,2/20/2025,6/1/2025,"$300,000",Additions to Existing Building,"This project is privately funded, on private land for private use.","Tenant infill in existing building, space is empty from inside.","1,221 ft 2",Kashyap Arvindbhai Patel,"7701 Chief Spotted Tail Rd, McKinney, Texas 75050",(226) 260-4132,,,,https://www.tdlr.texas.gov/TABS/Search/Project/TABS2025012118,
"Chuy's - Mansfield, TX",TABS2025012090,Chuy's Fine Tex Mex,"640 N US 287, Mansfield, TX 75001",Tarrant,4/14/2025,11/3/2025,"$1,800,000",New Construction,"This project is privately funded, on private land for private use.",Ground of construction of full-service commercial restaurant with associated site work and landscaping ,"6,579 ft 2",Chuys Opco Inc,"1623 Toomey Rd, Austin, Texas 78704",949-903-5283,Apogee Architectural Partners,"16775 Addison Rd Suite 300, Addison, Texas 75001",(940) 331-0618,https://www.tdlr.texas.gov/TABS/Search/Project/TABS2025012090,
CBOCS 205 FORT WORTH TX - ADA PARKING AREA MAINTENANCE,TABS2025012083,Cracker Barrel Old Country Store,"4691 Gemini Pl, Fort Worth, TX 76087",Tarrant,4/15/2025,4/15/2026,"$54,000",Renovation/Alteration,"This project is privately funded, on private land for private use.","ADA parking area maintenance - concrete pavement removal/replacement, new striping of parking stalls, remove/replace designated accessible parking signs","1,250 ft 2",Cracker Barrel Old Country Store,"PO Box 787, Lebanon, Tennessee 37087",(304) 610-4010,"CESO, Inc.","2800 Corporate Exchange Blvd. Ste. 400, Columbus, Ohio 43231",(614) 893-6803,https://www.tdlr.texas.gov/TABS/Search/Project/TABS2025012083,
Technagy Office Expansion - Tenant Finish Out,TABS2025012044,700 Highlander,"700 Highlander Suite 402, Arlington, TX 75016",Tarrant,3/10/2025,5/5/2025,"$80,000",Renovation/Alteration,"This project is privately funded, on private land for private use.","Tenant finish out of an existing 1,436 SF office space.","1,436 ft 2",Holt Lunsford Commercial,"700 Highlander Blvd Suite 440, Arlington, Texas 76015",682.252.4363,Killian Design LLC,"3400 N Central Expwy Suite 110-307, Richardson, Texas 75080",(214) 457-3652,https://www.tdlr.texas.gov/TABS/Search/Project/TABS2025012044,Shadi Awad
