project_name,project_number,facility_name,location_address,location_county,start_date,completion_date,est_cost,work_type,fund_type,scope,sq_ft,own_name,own_address,own_phone,design_name,design_address,design_phone,project_url,tenant_name
HEB Forney Gateway East Retail Bldg,TABS2024018321,HEB Corp#795,"US Hwy 80 & Gateway Blvd, Forney, TX 75126",Kaufman,7/29/2024,9/24/2025,"$2,497,392",New Construction,"This project is privately funded, on private land for private use.","Proposed H-E-B retail building will consist of mainly (1) level of non-separated mixed use, meeting the allowable area & height. 10,898 SqFt.","10,898 ft 2","H-E-B Grocery Company, LP","646 South Flores Street, San Antonio, Texas 78204",(830) 931-1315,RSP Architects,"600 W 6th Street, Ste 100, Fort Worth, Texas 76102",(682) 200-0343,https://www.tdlr.texas.gov/TABS/Search/Project/TABS2024018321,
HEB Forney Gateway East FSCW,TABS2024018320,HEB Corp#795,"US Hwy 80 & Gateway Blvd, Forney, TX 75126",Kaufman,7/29/2024,9/24/2025,"$1,852,698",New Construction,"This project is privately funded, on private land for private use.","Proposed H-E-B Fuel Station & Car Wash 8,668 SqFt will consist of one single story motor fuel dispensing facility and one single story car wash structure.","8,668 ft 2","H-E-B Grocery Company, LP","646 South Flores Street, San Antonio, Texas 78204",(830) 931-1315,RSP Architects,"600 W 6th Street Ste 100, Fort Worth, Texas 76102",(682) 200-0343,https://www.tdlr.texas.gov/TABS/Search/Project/TABS2024018320,
HEB Forney Gateway East Store,TABS2024018319,HEB Corp#795,"US Hwy 80 & Gateway Blvd, Forney, TX 75126",Kaufman,7/29/2024,9/24/2025,"$42,400,010",New Construction,"This project is privately funded, on private land for private use.","Proposed H-E-B Store building will consist of mainly (1) level of non-separated mixed use TTBBQ on the second floor, meeting the allowable area & height. 138,302 SqFt","138,302 ft 2","H-E-B Grocery Company, LP","646 South Flores Street, San Antonio, Texas 78204",(830) 931-1315,RSP Architects,"600 W 6th Street, Ste 100, Fort Worth, Texas 76102",(682) 200-0343,https://www.tdlr.texas.gov/TABS/Search/Project/TABS2024018319,
Planet Fitness Forney - Shell,TABS2024018313,Planet Fitness Forney,"West/Southwestern Quadrant of FM548 & FM740 RIDGECREST CENTER ADDITION, BLOCK A, LOT 3B; REPLA, Forney, TX 75166",Kaufman,7/1/2024,3/1/2025,"$3,250,000",New Construction,"This project is privately funded, on private land for private use.",new shell building for future tenant Planet Fitness,"20,000 ft 2",Guy Grivas,"550 Reserve Street Suite 190, Southlake, Texas 76092",(214) 865-7447,,,,https://www.tdlr.texas.gov/TABS/Search/Project/TABS2024018313,
THR ASC Forney - Tenant Finish-Out,TABS2024018245,Forney ASC & MOB,"250 Kroger Dr, Forney, TX 75126",Kaufman,12/2/2024,10/6/2025,"$7,000,000",New Construction,"This project is privately funded, on private land for private use.","Interior finish-out for a new free-standing single-story ambulatory surgical center, including 4 ORs and 1 procedure room","17,963 ft 2",Prime Healthcare Properties,"6959 Lebanon Rd Suite 212, Frisco, Texas 75034",(256) 428-0060,Grace Hebert Curtis Architects,"5000 Quorum Dr Suite 500, Dallas, Texas 75254",(214) 378-9810,https://www.tdlr.texas.gov/TABS/Search/Project/TABS2024018245,Russ Goodgion
Eastland Phase 4,TABS2024017977,Eastland Phase 4,"Approx 2800 ft E of CR 269 & FM 741 Intersection, Crandall, TX 75114",Kaufman,12/1/2024,3/1/2025,"$1,917,000",New Construction,"This project is privately funded, on private land for private use.","Project scope includes street paving, grading, storm drainage, water and sanitary sewer improvements for a single family residential development. ","16,674 ft 2",Lennar Homes of Texas Land & Construction,"1707 Marketplace Blvd, Suite 100, Irving, Texas 75063",903-821-2188,"LJA Engineering, Inc.","6060 North Central Expressway, Suite 400, Dallas, Texas 75206",214-451-0881,https://www.tdlr.texas.gov/TABS/Search/Project/TABS2024017977,
