project_name,project_number,facility_name,location_address,location_county,start_date,completion_date,est_cost,work_type,fund_type,scope,sq_ft,own_name,own_address,own_phone,project_url,design_name,design_address,design_phone
The Pretty House,TABS2025024329,The Pretty House,"106 S jefferson St, Kaufman, TX 75142",Kaufman,7/25/2025,1/31/2026,"$150,000",Renovation/Alteration,"This project is privately funded, on private land for private use.","Remodel, demolition","1,400 ft 2",Josh and Jenna Beard,"111 Princeton Circle, Forney, Texas 75126",(214) 244-8926,https://www.tdlr.texas.gov/TABS/Search/Project/TABS2025024329,,,
Kaufman Ag Barn,TABS2025024260,Kaufman Ag Barn,"Hampton Ct Dr. @ The Oaks St., Kaufman, TX 75142",Kaufman,9/15/2025,8/2/2027,"$4,981,224",New Construction,"This project involves public funds, public land, or is a Federally funded roadway project.",1 story agricultural facility,"13,675 ft 2",Kaufman ISD,"1000 S. Houston St., Kaufman, Texas 75142",972-932-2622,https://www.tdlr.texas.gov/TABS/Search/Project/TABS2025024260,VLK,"5801 Tennyson Pkwy #100, Plano, Texas 75024",(972) 265-1885
Kaufman Middle School,TABS2025024258,Kaufman Middle School,"5021 S Houston St., Kaufman, TX 75142",Kaufman,9/15/2025,8/2/2027,"$91,049,419",New Construction,"This project involves public funds, public land, or is a Federally funded roadway project.",2 story new middle school,"186,923 ft 2",Kaufman ISD,"1000 S. Houston St., Kaufman, Texas 75142",972-932-2622,https://www.tdlr.texas.gov/TABS/Search/Project/TABS2025024258,VLK,"5801 Tennyson Pkwy #100, Plano, Texas 75024",(972) 265-1885
THE PEACH COBBLER FACTORY - FORNEY,TABS2025024241,"VICTORY MARKET RETAIL LOT 8, LLC.","512 W HWY 80, Forney, TX 75126",Kaufman,8/1/2025,9/1/2025,"$125,000",Renovation/Alteration,"This project is privately funded, on private land for private use.",INTERIOR FINISH OUT OF EXISTING SUITE FOR RETAIL STORE ...,"1,600 ft 2","VICTORY MARKET RETAIL LOT 8, LLC.","512 W HWY 80, FORNEY, Texas 75126",(469) 646-6187,https://www.tdlr.texas.gov/TABS/Search/Project/TABS2025024241,THOMAS DESIGN TECHNOLOGIES,"1312 RABBIT RIDGE, CEDAR HILL, Texas 75104",(972) 672-8927
K&L Co. Business Park LLC,TABS2025024161,K&L Co. Business Park LLC,"18514 FM 740, Forney, TX 75216",Kaufman,8/31/2025,8/31/2027,"$10,000,000",New Construction,"This project is privately funded, on private land for private use.",Development and construction of a 70-80K SF flex industrial business park in Forney. Development to roughly split into two phases with approximately 42K SF being developed in Phase 1 with most site infrastructure installed in Phase 1.,"75,000 ft 2",K&L Co. Business Park LLC,"1330 Dowdy Ferry Rd, Hutchins, Texas 75216",(214) 384-3038,https://www.tdlr.texas.gov/TABS/Search/Project/TABS2025024161,Abide Designs,"6428 Dominion Dr, Royse City, Texas 75189",(972) 533-0959
