project_name,project_number,facility_name,location_address,location_county,start_date,completion_date,est_cost,work_type,fund_type,scope,sq_ft,own_name,own_address,own_phone,design_name,design_address,design_phone,project_url
Forvia Phase 1 Warehouse / Office and Equipment,TABS2025008211,Rockwall Park 30,"1220 Data Drive, Rockwall, TX 75032",Rockwall,2/1/2025,5/31/2025,"$150,000",New Construction,"This project is privately funded, on private land for private use.","Phase 1 Warehouse, office and equipment",787 ft 2,"USEF Rockwall Owner, LLC","9830 Colonnade Blvd. Suite 600, San Antonio, Texas 78230",(816) 232-6057,"Pross Design Group, Inc.","5310 Harvest Hill Road Suite 180, DALLAS, Texas 75230",(972) 759-1400,https://www.tdlr.texas.gov/TABS/Search/Project/TABS2025008211
Founders Hall - Exterior Upgrades,TABS2025008138,"Lowe & Allen, Block 8, Acre 0.904","401 Rusk Street, Rockwall, TX 75087",Rockwall,2/1/2025,8/1/2025,"$51,000",Renovation/Alteration,"This project is privately funded, on private land for private use.","Add sidewalks, ADA curb cuts, add trees, remove trees, landscaping. ","19,000 ft 2",Ridge Pointe Commercial,"102 S Goliad Street, Suite 200, Rockwall, Texas 75087",972-961-8532,"Stenstrom-Schneider, Inc.","13748 Neutron Road, Suite120, Farmers Branch, Texas 75244",214-461-9831,https://www.tdlr.texas.gov/TABS/Search/Project/TABS2025008138
Founders Hall - Exterior Upgrades,TABS2025008136,"Lowe & Allen, Block 8, Acre 0.904","401 Rusk Street, Rockwall, TX 75087",Rockwall,2/1/2025,8/1/2025,"$180,000",Renovation/Alteration,"This project is privately funded, on private land for private use.","Add brick to facades (4 sides), add 4 canopies, extend parapets (4 locations)","13,500 ft 2",Ridge Pointe Commercial,"102 S Goliad Street, Suite 200, Rockwall, Texas 75087",972-961-8532,"Stenstrom-Schneider, Inc.","13748 Neutron Road, Suite 120, Farmers Branch, Texas 75244",214-461-9831,https://www.tdlr.texas.gov/TABS/Search/Project/TABS2025008136
Heath Towne Center Park,TABS2025007888,City Of Heath,"1000 Festive St, Heath, TX 75032",Rockwall,11/1/2024,11/30/2025,"$12,500,000",Renovation/Alteration,"This project is privately funded, on private land for private use.",Renovation & Addition to Old City Park,"15,250 ft 2",City Of Heath,"200 Lawrence Dr, Heath, Texas 75032",(972) 961-4891,Kimley Horn,"2500 Pacific Ave #1100, Dallas, Texas 75226",(972) 770-1315,https://www.tdlr.texas.gov/TABS/Search/Project/TABS2025007888
City of Heath - Public Works Operations Building,TABS2025007727,Public Works Operations Building,"1284 FM 740, Heath, TX 75032",Rockwall,1/15/2025,11/15/2025,"$4,500,000",New Construction,"This project involves public funds, public land, or is a Federally funded roadway project.","10,859 SF 1-story building + 1,222 SF mezzanine. Includes offices, maintenance shop, storage areas, site work.","12,081 ft 2",City of Heath,"200 Laurence Drive, Heath, Texas 75032",(972) 961-4892,"Freeman-Millican, Inc.","9330 LBJ Freeway, Ste 1225, Dallas, Texas 75243",(214) 729-6171,https://www.tdlr.texas.gov/TABS/Search/Project/TABS2025007727
