project_name,project_number,facility_name,location_address,location_county,start_date,completion_date,est_cost,work_type,fund_type,scope,sq_ft,own_name,own_address,own_phone,tenant_name,design_name,design_address,design_phone,project_url
Commercial Amusement Arcade,TABS2024014916,Castle Hills Village Shops,"2500 King Arthur Blvd. #122, Lewisville, TX 75056",Denton,4/15/2024,6/1/2024,"$160,000",Renovation/Alteration,"This project is privately funded, on private land for private use.",Renovation of an exsiting commercial space for arcade gameroom and bar,"2,465 ft 2","Castle Hill Village Shops, LLC","4400 State Hwy 121 Suite 900, Lewiville, Texas 75056",(469) 630-7770,Eric Zdenek,PMS Designs,"9202 Flickering Shadow Drive, Dallas, Texas 75243",214-417-4910,https://www.tdlr.texas.gov/TABS/Search/Project/TABS2024014916
Discovery Point Amenity Center,TABS2024014904,Discovery Point Amenity Center,"421 Beall Street, Denton, TX 76207",Denton,6/3/2024,12/9/2024,"$180,000",New Construction,"This project is privately funded, on private land for private use.",New construction of amenity center / sales office,"1,200 ft 2","FR-BEALL, LLC","11 Dupont Circle NW Suite 900, Washington DC, Washington D.C 20036",(202) 584-0055,,"HMS Architecture, PLLC","208 S. Johnson Street Suite 316, McKinney, Texas 75069",(972) 897-5861,https://www.tdlr.texas.gov/TABS/Search/Project/TABS2024014904
Eagle 212,TABS2024014884,Eagle Surveying,"212 W Sycamore St., Denton, TX 76201",Denton,4/1/2024,10/1/2024,"$1,000,000",Additions to Existing Building,"This project is privately funded, on private land for private use.","New addition to an existing building. The existing building is 3,720 SF with existing to remain as 2,140 SF. Demolish portion of building, new finishes only to existing to remain, and new second story addition for a total square footage of 5,650 SF","5,650 ft 2","One Way Street Investments, LLC","212 S Elm St., Denton, Texas 76201",(940) 891-2947,Dan Rick,MKOA LLC,"1220 Kendolph Dr., Denton, Texas 76205",940-331-5237,https://www.tdlr.texas.gov/TABS/Search/Project/TABS2024014884
EMORY NAIL LOUNGE,TABS2024014745,LAKE FOREST PLAZA,"2840 FLOWER MOUND RD, Flower Mound, TX 75022",Denton,5/1/2024,8/1/2024,"$150,000",New Construction,"This project is privately funded, on private land for private use.",INTERIOR REMODEL ,"2,400 ft 2",FAB 5 MANAGEMENT LLC,"1217 KENTUCKY DERBY DR, BARTONVILLE, Texas 76226",(435) 229-4200,MENDY TRAN,NGUYEN CHAU DESIGNER & CONSULTING,"1207 FOX CHASE DR, MANSFIELD, Texas 76063",(682) 583-0921,https://www.tdlr.texas.gov/TABS/Search/Project/TABS2024014745
TWU ACT 15 & 16 Renovation,TABS2024014724,TWU Administrative and Conference Tower,"304 Administration Drive, Denton, TX 76204",Denton,5/15/2024,12/15/2024,"$1,000,000",Renovation/Alteration,"This project is privately funded, on private land for private use.",Renovation of existing conference space. ,"6,000 ft 2",Texas Woman's University,"1200 Frame Street, Denton, Texas 76209",(940) 594-3947,,Hahnfeld Hoffer Stanford a GHC Studio,"200 Bailey Avenue Suite 200, Fort Worth, Texas 76107",(817) 921-5928,https://www.tdlr.texas.gov/TABS/Search/Project/TABS2024014724
Hazelwood,TABS2024014710,Hazelwood,"SE Corner of FM 423 and Rockhill Parkway, Frisco, TX 75034",Denton,11/9/2022,4/5/2024,"$16,455,686",New Construction,"This project is privately funded, on private land for private use.",Civil developments for a residential subdivision. 146.634 acres,"6,387,377 ft 2","GBRK Edgewood, LLC","5501 Headquarters Drive, Suite 300W, Plano, Texas 75024",972-310-4545,,Kimley-Horn,"13455 Noel Road, Suite 700, Dallas, Texas 75240",817-301-4332,https://www.tdlr.texas.gov/TABS/Search/Project/TABS2024014710
"Kerr Hall Interior Renovation - Lobby, Restroom,& Laundry",TABS2024014620,Kerr Hall,"1413 W. Maple St., Denton, TX 76205",Denton,5/1/2024,8/1/2024,"$2,247,525",Renovation/Alteration,"This project involves public funds, public land, or is a Federally funded roadway project.","Approximately 9,300 square foot renovation of the Kerr Residence Hall Lobby. Scope includes construction of a new laundry room & community kitchen. ","9,300 ft 2",University of North Texas,"1155 Union Circle #311040, Denton, Texas 76201",(940) 369-8583,,TreanorHL,"2554 Elm Street Suite 200, Dallas, Texas 75226",(785) 766-4064,https://www.tdlr.texas.gov/TABS/Search/Project/TABS2024014620
Kent Companies - office renovation,TABS2024014593,Kent Companies,"830 Valley Ridge Blvd, Lewisville, TX 75057",Denton,6/1/2024,8/9/2024,"$280,000",Renovation/Alteration,"This project is privately funded, on private land for private use.","Interior office renovation to provide additional private offices and enlarged toilet rooms.  The area to be renovated consists of 2,160 SF.","2,160 ft 2","Kent-Andersen Properties, LLC","130 60th Street, SW, Grand Rapids, Michigan 49548",616-534-4909,,Architectural Concepts,"6650 Crossign Drive, SE, Grand Rapids, Michigan 49508",616-554-1222,https://www.tdlr.texas.gov/TABS/Search/Project/TABS2024014593
Chase Harvest Argyle,TABS2024014563,Chase Harvest Argyle,"NWC of FM 407 & I-35W, Argyle, TX 76226",Denton,4/22/2024,10/22/2024,"$3,000,000",New Construction,"This project is privately funded, on private land for private use.","New Construction of a 1-Story Retail Banking Center w/ Drive-Up ATM - (3,434 sq ft)","3,434 ft 2","Realty Capital Argyle 114, LTD","9800 Hillwood Parkway, Suite 300, Fort Worth, Texas 76177",(817) 224-6033,JPMorgan Chase Bank - Joe Hernandez,Rouch Architects,"1445 Ross Ave #5700, Dallas, Texas 75202",214-997-6029,https://www.tdlr.texas.gov/TABS/Search/Project/TABS2024014563
