project_name,project_number,facility_name,location_address,location_county,start_date,completion_date,est_cost,work_type,fund_type,scope,sq_ft,own_name,own_address,own_phone,design_name,design_address,design_phone,project_url,tenant_name
Gas Monkey,TABS2025008463,LSA Grandscape,"4545 Destination Dr, The Colony, TX 75056",Denton,2/3/2025,5/16/2025,"$200,000",Renovation/Alteration,"This project is privately funded, on private land for private use.",Addition of a bar to the existing dining area. Adding roll up windows,"9,783 ft 2",Grandscape,"5600 Nebraska Furniture Mart Dr, The Colony, Texas 75056",(972) 668-1515,WILLIAM PECK  ASSOC INC,"105 W MAIN ST, LEWISVILLE, Texas 75057",(972) 221-1424,https://www.tdlr.texas.gov/TABS/Search/Project/TABS2025008463,
"POLLE, MARK",TABS2025008462,FIRM FOUNDATION DENTAL,"2700 W. FRONTIER PARKWAY SUITE 120, Prosper, TX 75078",Denton,2/10/2025,6/9/2025,"$344,625",New Construction,"This project is privately funded, on private land for private use.",INTERIOR FINISHOUT FOR DENTAL OFFICE ,"2,401 ft 2","NWC TOLLWAY-FRONTIER, LP","3102 MAPLE AVE SUITE 500, DALLAS, Texas 75201",214-720-3621,,,,https://www.tdlr.texas.gov/TABS/Search/Project/TABS2025008462,
Drybar,TABS2025008446,The Shops at Highland Village,"1400 SHOAL CREEK STE F120, Highland Village, TX 75077",Denton,2/1/2025,6/1/2025,"$225,000",Renovation/Alteration,"This project is privately funded, on private land for private use.",Tenant Finish for a Salon in prior Retail use strip center.,"1,653 ft 2",MP SHOPS AT HIGHLAND VILLAGE LLC,"c/o Poag Shopping Centers, LLC 1770 Kirby Parkway, Suite 215, Memphis, Tennessee 38138",(469) 301-8226,Design Parameters LLC,"6373 Silver Stream Ln, Frisco, Texas 75036",(214) 784-5014,https://www.tdlr.texas.gov/TABS/Search/Project/TABS2025008446,Rowena Rynd
FIFTH GEAR - ARGYLE,TABS2025008403,FIFTH GEAR AUTOMOTIVE REPAIR,"1612 E FM 407, Argyle, TX 76226",Denton,2/1/2025,8/31/2025,"$2,400,000",New Construction,"This project is privately funded, on private land for private use.",FINISH OUT ,975 ft 2,DRES 1612 FM 407 LLC,"359 LAKE PARK RD #STE. 120, LEWISVILLE, Texas 75057",(972) 317-4005,WRIGHT GROUP ARCHITECTS PLLC,"1430 SOUTH BROADWAY ST, CARROLLTON, Texas 75006",(972) 242-1015,https://www.tdlr.texas.gov/TABS/Search/Project/TABS2025008403,
Horizon - Sandbrock Amenity II,TABS2025008389,Sandbrock Amenity II,"4720 Sandbrock Parkway, Aubrey, TX 76227",Denton,1/1/2025,5/26/2025,"$3,100,000",New Construction,"This project is privately funded, on private land for private use.","New construction of amenity center including pool, entry pavilion, cabanas & 2,600sf pool building w/ restrooms & pool equipment spaces.","2,600 ft 2",Horizon Deer Creek Development Corporation,"5760 Legacy Drive, Suite B3-388, Plano, Texas 75024",214-215-4781,"LRK, Inc.","150 Turtle Creek Blvd., Suite 104D, Dallas, Texas 75207",214-389-3816,https://www.tdlr.texas.gov/TABS/Search/Project/TABS2025008389,
