project_name,project_number,facility_name,location_address,location_county,start_date,completion_date,est_cost,work_type,fund_type,scope,sq_ft,own_name,own_address,own_phone,tenant_name,design_name,design_address,design_phone,project_url
Jersey Mike's Hickory Creek,TABS2026006858,Victory Shops at Hickory Creek,"3100 FM 2181, Suite 121, Hickory Creek, TX 76210",Denton,2/9/2026,5/11/2026,"$390,000",Renovation/Alteration,"This project is privately funded, on private land for private use.","Tenant finish-out of new ‘First Generation’ retail shell strip centre space into a new Jersey Mike’s Subs restaurant with new kitchen equipment, interior walls, mechanical, electrical and plumbing work & finishes.","1,400 ft 2",VICTORY SHOPS AT HICKORY CREEK I LLC,"2911 TURTLE CREEK BLVD STE 700, DALLAS, Texas 75219",555-555-5555,Chad Huffhines,AEP America,"PO Box 123655, Fort Worth, Texas 76121",(214) 702-1528,https://www.tdlr.texas.gov/TABS/Search/Project/TABS2026006858
"BELL, LANDON",TABS2026006823,ALTA FAMILY DENTAL,"3100 FM 2181 SUITE 117, Hickory Creek, TX 75065",Denton,12/22/2025,3/16/2026,"$312,500",New Construction,"This project is privately funded, on private land for private use.",INTERIOR FINISHOUT ,"2,200 ft 2",VICTORY SHOPS AT HICKORY CREEK I LLC,"600 SHERMAN ST SUITE 108, RICHARDSON, Texas 75081",972-834-4892,,,,,https://www.tdlr.texas.gov/TABS/Search/Project/TABS2026006823
Northlake Bible Church Phase 1,TABS2026006814,Northlake Bible Church,"Not Assigned Suite 200D, Northlake, TX 76226",Denton,1/5/2026,12/4/2026,"$7,000,000",New Construction,"This project is privately funded, on private land for private use.","New construction of a 24,950 sf church building with parking lot and site utilities installation. ","24,950 ft 2",Northlake Bible Church,"133 Old Town Blvd Suite 200D, N Lantana, Texas 76226",(903) 926-4280,,,,,https://www.tdlr.texas.gov/TABS/Search/Project/TABS2026006814
Denton Prosperity Shopping Center,TABS2026006729,Denton Prosperity Shopping Center,"2740 & 2760 I35 E., Denton, TX 76210",Denton,2/1/2026,2/1/2027,"$5,000,000",New Construction,"This project is privately funded, on private land for private use.","New 33,000 S.F. shopping center","33,000 ft 2",Denton Prosperity Investments Inc.,"18526 Cascade Timbers Lane, Tomball, Texas 77377",(832) 588-8183,,Citiscape architecture & Planning,"6200 Savoy Dr., #500, Houston, Texas 77036",(713) 783-3188,https://www.tdlr.texas.gov/TABS/Search/Project/TABS2026006729
Hundley Drive and Shady Shores Road Construction,TABS2026006709,Hundley Drive and Shady Shores Road Construction,"Hundley Drive at Shady Shores, Lake Dallas, TX 75065",Denton,2/1/2026,3/31/2028,"$18,000,000",New Construction,"This project involves public funds, public land, or is a Federally funded roadway project.",New Road Construction,"1,152,526 ft 2",City of Lake Dallas,"212 Main Street, Lake Dallas, Texas 75065",(940) 497-2226,,McAdams,"4400 State Highway 121, Suite 800, Lewisville, Texas 75056",(972) 310-7328,https://www.tdlr.texas.gov/TABS/Search/Project/TABS2026006709
Christian Brothers Automotive - Denton,TABS2026006703,Christian Brothers Automotive,"3130 North I-35, Denton, TX 76201",Denton,4/6/2026,10/27/2026,"$950,000",New Construction,"This project is privately funded, on private land for private use.",new ground up construction ,"6,033 ft 2",CBH PROPERTIES DENTON LLC,"17725 Katy Freeway, Ste 200, Katy, Texas 77094",281-675-6100,,Fusion-AE,"6201 Campus Cirlce Dr E, Irving, Texas 75232",(469) 579-2227,https://www.tdlr.texas.gov/TABS/Search/Project/TABS2026006703
1United,TABS2026006619,15691 FM 423,"15691 FM 423 Suite 300, Frisco, TX 75033",Denton,12/1/2025,3/15/2026,"$1,100,000",Renovation/Alteration,"This project is privately funded, on private land for private use.",Interior Renovation,"47,306 ft 2","DG Frisco Logistics Center Property Owner, LP","17304 Preston Rd Ste 550, Dallas, Texas 75252",(972) 733-6943,,,,,https://www.tdlr.texas.gov/TABS/Search/Project/TABS2026006619
145 ROSE LN,TABS2026006596,14519 ROSE LN LLC,"145 ROSE LANE, Denton, TX 75033",Denton,3/1/2026,8/31/2026,"$3,800,000",New Construction,"This project is privately funded, on private land for private use.",3 INDUSTRIAL BUILDINGS ,"38,000 ft 2",14519 Rose Lane LLC,"1275 YUMA DR, FRISCO, Texas 75033",(469) 605-5841,,Stan Ingran & Associates,"COPPELL, COPPELL, Texas 75019",(972) 679-6852,https://www.tdlr.texas.gov/TABS/Search/Project/TABS2026006596
